<?xml version="1.0" encoding="UTF-8"?>
<!DOCTYPE bd SYSTEM "modelo.dtd">
<bd nome="soveteria">
    <tabela nome="clientes" primario="idCliente">
        <campo nome="idCliente" tipo="inteiro"  func="auto-iclemento" />
        <campo nome="nome" tipo="texto" tamanho="50"/>
        <campo nome="telefone" tipo="texto" tamanho="12"/>
    </tabela>
    <tabela nome="venderores" primario="idVendedor">
        <campo nome="idVendedor" tipo="inteiro" func="auto" />
        <campo nome="nome" tipo="texto" tamanho="50"/>
        <campo nome="telefone" tipo="texto" tamanho="12"/>
    </tabela>
    <tabela nome="e">
        <campo nome="" func="" tamanho="1" tipo="inteiro"></campo>
    </tabela>
</bd>
